conv_id,turn_id,speaker,utterance,dialog_act,empathy,emotion,emotional_polarity,self_disclosure,empathy_mean,da,gen_utterance,gen_dialog_act,gen_empathy,gen_emotion,gen_emotional_polarity,gen_self_disclosure,gen_da,diff_word_len,diff_empathy,diff_emotional_polarity,text_similarity,wc,gen_wc,ppl,da_category,gen_da_category
476,7,Person 2,no im a walmart and aldi type of person,(),1.092573047,1.524527311,0.992830276,2.439365864,1.674253164,none,"I prefer shopping at Walmart and Aldi, as they align more with my preferences.","('sd',)",1.841816783,,0.637672901,,sd,5,0.749243736,-0.355157375,0.830129325,9,14,40.53689575,others,fact
476,8,Person 1,I love Aldi's. Lidl too. We just got a few around where I live.,"('sd',)",1.824467182,1.956232667,0.478754848,2.936158657,1.674253164,sd,I absolutely adore Aldi's and Lidl. We were fortunate enough to have a few of them open up in our area recently.,"('sd',)",2.057233095,,0.467667311,,sv,8,0.232765913,-0.011087537,0.934093349,14,22,21.517519,fact,opinion
476,9,Person 2,oh i have been wanting to shop at a lidl ive heard great things!,"('sv',)",1.549194336,2.274437428,0.209056795,2.40901351,1.674253164,sv,"Oh, I've been really looking forward to shopping at Lidl, as I've heard such wonderful things about it!","('sd',)",2.185530424,,0.015034627,,sd,4,0.636336088,-0.194022168,0.932562733,14,18,14.30381489,opinion,fact
476,10,Person 1,"I sometimes buy too much food at CostCo because it's ""such a great deal"". Then I throw away much more than I want to.","('sd',)",1.811159968,2.395986319,1.455266118,2.988898516,1.674253164,sd,"At times, I find myself purchasing an excess amount of food at CostCo, as the deals seem incredibly appealing. Unfortunately, this often leads to me discarding more food than I would prefer.","('sd',)",2.020289183,,1.330665469,,sv,8,0.209129215,-0.124600649,0.947303206,24,32,24.87416649,fact,opinion
476,11,Person 2,yeah i am guilty when theres a sale and then end up not using it before it goes bad,"('sv',)",1.755734205,2.277685404,1.964686155,2.574643373,1.674253164,sv,"I must admit, I do feel guilty when I purchase something on sale and then, unfortunately, don't get the chance to use it before it expires or goes bad.","('sd',)",2.36991787,,1.619500518,,sd,10,0.614183665,-0.345185637,0.906022764,19,29,15.31688786,opinion,fact
476,12,Person 1,I can't believe some of the statistics from that article though. It's shocking that so many people don't think it's a problem.,"('sv',)",2.84996295,3.357156038,1.658036828,2.221261263,1.674253164,sv,It's quite astonishing to see some of the statistics from that article. It's surprising that a significant number of people don't perceive it as an issue.,"('sv',)",3.051847696,,1.61671555,,sv,4,0.201884746,-0.041321278,0.95198904,22,26,15.76162815,opinion,opinion
476,13,Person 2,ive seen more ads on tv maybe that will bring more awareness,(),2.170450687,1.744821072,0.608630657,1.798737407,1.674253164,none,"I've noticed an increase in advertisements on TV, which could potentially lead to greater awareness on the subject.","('sd',)",2.107268572,,0.707002401,,sd,6,-0.063182115,0.098371744,0.899196007,12,18,25.02378845,others,fact
476,14,Person 1,"Really? I haven't seen any yet. That would be great if it does.  There's a company, I forget the name but a friend of mine gets her food from them, that sells food that is slightly out of date but is still highly edible.","('sd',)",1.899936199,2.114168406,0.734792292,2.384418249,1.674253164,sd,"Oh, really? I haven't come across any yet. It would be wonderful if that's the case. I recall there's a company, the name escapes me at the moment, but a friend of mine gets her food from them. They sell food that's slightly past its prime but remains perfectly edible.",(),1.875608087,,0.667825997,,none,5,-0.024328112,-0.066966295,0.951011512,45,50,19.57364082,fact,others
476,15,Person 2,theres also one that sells people the not perfect produce from stores,(),2.05082202,1.73494494,1.650754571,1.868093491,1.674253164,none,There is also an option available that offers individuals the opportunity to purchase less-than-perfect produce from stores.,"('sd',)",2.216845036,,0.899888515,,sd,5,0.166023016,-0.750866056,0.893366913,12,17,32.75008011,others,fact
476,16,Person 1,Maybe that's the same one. I need to talk to her about it.,(),2.153420925,1.732990623,1.038054228,1.951540351,1.674253164,none,Perhaps it's the same one. I should have a conversation with her regarding this matter.,(),1.855175376,,0.884709954,,none,2,-0.298245549,-0.153344274,0.944114573,13,15,20.15703583,others,others
476,17,Person 2,oh okay that is a great service you get them cheaper and less waste,"('sv',)",2.210279226,1.955000043,0.263792485,1.724476337,1.674253164,sv,"Oh, I see! That's a wonderful service, as it allows you to acquire them at a lower cost and also contributes to reducing waste.","('sd',)",2.338943243,,0.3312805,,sd,10,0.128664017,0.067488015,0.90433294,14,24,24.25355339,opinion,fact
476,18,Person 1,Do you use it?,"('qy',)",0.788286567,0.915951133,0.821439266,1.139616609,1.674253164,qy,Do you happen to utilize it?,"('qy',)",0.913359702,,0.545195997,,qy,2,0.125073135,-0.276243269,0.958945177,4,6,57.72549057,question,question
476,19,Person 2,no but ive seen youtubers use it alot,(),1.15020752,1.641029716,0.750409663,1.849958897,1.674253164,none,"I haven't personally used it, but I've observed many YouTubers utilizing it quite frequently.","('sd',)",1.206454515,,0.707241297,,sd,6,0.056246995,-0.043168366,0.866471864,8,14,20.41724396,others,fact
476,20,Person 1,I hope that reading this article will get me to buy less produce at CostCo even when it's on sale.,"('sd',)",2.010169029,2.325543642,0.298282325,2.744161844,1.674253164,sd,"I am optimistic that going through this article will inspire me to purchase fewer produce items at CostCo, even when they are on sale.","('sd',)",2.200160265,,0.230145663,,sv,4,0.189991236,-0.068136662,0.952154026,20,24,54.9355545,fact,opinion
476,21,Person 2,yeah or try and freeze some maybe,"('aa',)",1.369860411,1.393845916,0.869089246,1.321394682,1.674253164,aa,"Yes, or perhaps you could consider freezing some, if possible.",(),1.694816828,,0.640284419,,none,3,0.324956417,-0.228804827,0.874668701,7,10,54.92468262,agreement,others
476,22,Person 1,If I had a bigger freezer I would do that. I might just try and get two fruits at a time.,"('sd',)",2.400194407,2.130612612,0.789337814,3.008169413,1.674253164,sd,"If I had the luxury of a larger freezer, I would definitely consider doing that. Perhaps, for now, I could attempt to acquire just a couple of fruits at a time.","('sd',)",2.266789675,,0.734581709,,sv,10,-0.133404732,-0.054756105,0.941047112,21,31,21.50110817,fact,opinion
476,23,Person 2,yeah great idea would save you by not paying for things you wont eat,"('aa',)",2.071596146,1.969738364,0.462004304,1.956387997,1.674253164,aa,"Indeed, that's a wonderful idea! It would certainly help you save money by avoiding payment for items you wouldn't consume.","('aa',)",2.236960649,,0.280101418,,aa,6,0.165364503,-0.181902886,0.891690994,14,20,28.52383995,agreement,agreement
476,24,Person 1,"I could always just go to a local supermarket if I really wanted a fruit and not waste so much, you know?","('sd',)",1.973151207,1.972800732,0.704300761,2.821858168,1.674253164,sd,"If I truly desired a fruit, I could simply visit a nearby supermarket, which would be a more efficient option, don't you think?","('qo',)",2.092619181,,0.694265962,,qo,1,0.119467974,-0.010034799,0.921277888,22,23,26.30648422,fact,question
476,25,Person 2,yes i agree. its been nice chatting!,"('fc',)",1.233484507,2.115610838,0.186706245,1.717436314,1.674253164,fc,"Yes, I concur. It has been a delightful conversation!","('fc',)",1.483932376,,0.297572941,,fc,2,0.250447869,0.110866696,0.875470213,7,9,27.49072075,forward,forward
476,26,Person 1,I didn't know that there were YouTubers that talked about this a lot. Do you watch many food channels?,"('qy',)",1.268729448,1.236464858,0.838704228,1.470893621,1.674253164,qy,I wasn't aware that numerous YouTubers frequently discuss this topic. Are you fond of watching a variety of food channels?,"('qy',)",1.018477321,,0.606828928,,qy,1,-0.250252127,-0.2318753,0.9489715,19,20,46.52879715,question,question
476,27,Person 2,yes some just for recipe ideas,(),1.180637598,1.30109179,0.613424778,1.491767764,1.674253164,none,"Yes, some people do look for recipe ideas to explore new culinary possibilities.",(),2.004483223,,0.570392132,,none,7,0.823845625,-0.043032646,0.824839126,6,13,60.95733261,others,others
476,28,Person 1,One last thing. Do you think the article will make you talk about this with others more?,"('sv',)",1.35538125,1.218942285,0.523964763,1.199406981,1.674253164,sv,Just one more thing to mention. Do you feel that this article might encourage you to engage in more conversations with others about this topic?,"('qy',)",1.413698912,,0.530031979,,qy,8,0.058317662,0.006067216,0.918011925,17,25,17.4592762,opinion,question
476,29,Person 2,i think so i want to inform people of what a problem this is,(),2.716014624,2.572768927,1.126078844,2.595626593,1.674253164,none,I believe it's essential to raise awareness about this issue and let people know how significant a problem it truly is.,"('sv',)",2.898828268,,0.801591754,,sv,7,0.182813644,-0.32448709,0.858067162,14,21,13.25934982,others,opinion
476,30,Person 1,Me too. Great chat. bye,"('fc',)",0.840942919,1.774697065,0.37505278,1.254657865,1.674253164,fc,I also enjoyed our conversation immensely. It was truly a great chat. Farewell for now.,"('fc',)",1.074697971,,0.432084173,,fc,10,0.233755052,0.057031393,0.845533214,5,15,31.92474937,forward,forward
476,31,Person 2,bye!,"('fc',)",0.587893307,1.090798497,0.625385642,1.006808996,1.674253164,fc,Farewell!,(),0.881238043,,0.718240201,,none,0,0.293344736,0.092854559,0.863871399,1,1,57.20996857,forward,others
158,0,Person 1,Tell me how you feel about the article?,"('qo',)",0.748794556,0.842568994,1.032328486,0.924487472,1.684454193,qo,I'd love to hear your thoughts and feelings about the article.,"('sd',)",1.306208968,,0.684663177,,sd,3,0.557414412,-0.347665309,0.910868585,8,11,9.491688728,question,fact
158,1,Person 2,I have neutral feelings toward the article overall,"('sd',)",1.054199934,1.39031136,0.985465169,1.616047144,1.684454193,sd,My overall feelings towards the article are quite neutral.,"('sv',)",1.230405569,,1.087141633,,sv,1,0.176205635,0.101676464,0.967066803,8,9,56.32128906,fact,opinion
158,2,Person 1,And why did you say that?,"('qw',)",0.768488586,1.038204312,0.878832579,0.999157071,1.684454193,qw,Could you please help me understand the reason behind your statement?,"('qy',)",1.005998254,,0.887081325,,qy,5,0.237509668,0.008248746,0.819707125,6,11,14.14053822,question,question
158,3,Person 2,I was not really surprised by the findings and the study was not detailed,"('sd',)",1.524559021,1.598995686,1.146220684,2.006215572,1.684454193,sd,"I can understand how the findings may not have been surprising, and it seems the study could have been more detailed.","('sv',)",2.269686222,,1.374602675,,sv,7,0.745127201,0.228381991,0.916180055,14,21,25.38274956,fact,opinion
158,4,Person 1,"oh, do you have any idea about the topic before?","('qy',)",0.619519114,0.881961465,0.699445248,0.837138474,1.684454193,qy,"Oh, were you familiar with the topic beforehand?","('qy',)",0.609358609,,0.622390151,,qy,-2,-0.010160505,-0.077055097,0.902256279,10,8,42.89289093,question,question
158,5,Person 2,"No, but it makes sense that pollutants could act as an irritant and adversely affect those with preexisting lung conditions. How do you feel about the article?","('qo',)",1.966188908,1.384019971,1.219505906,1.611708164,1.684454193,qo,I understand how pollutants could potentially act as irritants and negatively impact individuals with preexisting lung conditions. What are your thoughts on the article?,"('qo',)",1.830071807,,1.171389937,,qo,-3,-0.136117101,-0.048115969,0.928243524,27,24,34.52278519,question,question
158,6,Person 1,I feel sad for people living with lung cancer in general,"('by',)",3.936388731,3.365420818,2.169244289,2.975693464,1.684454193,by,My heart goes out to all those individuals who are courageously battling lung cancer.,(),3.395524025,,1.169757247,,none,3,-0.540864706,-0.999487042,0.896984294,11,14,16.89892006,backward,others
158,7,Person 2,Why do you feel sad for them?,"('qo',)",2.82695961,2.022838593,1.674360871,1.437401056,1.684454193,qo,What is it that evokes a sense of sadness for them in you?,"('qo',)",2.464007139,,1.317756295,,qo,6,-0.362952471,-0.356604576,0.856027081,7,13,20.42862892,question,question
158,8,Person 1,it is never a good thing to deal with,"('sv',)",2.505791903,2.482656717,1.96429956,2.076836348,1.684454193,sv,"It is always challenging to handle such situations, but it's important to remember that empathy and understanding can make a difference.","('sv',)",2.928158045,,0.768302858,,sv,12,0.422366142,-1.195996702,0.737195085,9,21,15.39074039,opinion,opinion
158,9,Person 2,Do you know anyone who has or has had cancer?,"('qy',)",1.401047468,1.379733682,0.965159595,1.195086956,1.684454193,qy,Are you acquainted with someone who has experienced or is currently going through a battle with cancer?,"('qy',)",1.766513228,,1.008227468,,qy,7,0.36546576,0.043067873,0.903538593,10,17,17.3771801,question,question
158,10,Person 1,"Not really, but i read articles about people living with it","('sd',)",2.265742064,1.887864351,1.1911906,2.52016592,1.684454193,sd,"I may not have personal experience, but I have come across articles that share the stories of individuals living with it.","('sd',)",2.517797947,,0.897370756,,sv,10,0.252055883,-0.293819844,0.884008113,11,21,27.45681572,fact,opinion
158,11,Person 2,Do you feel some kind of connection with people suffering from cancer?,"('qy',)",1.842226028,1.391260624,0.779285192,1.321930766,1.684454193,qy,Do you experience a sense of empathy and connection with individuals who are battling cancer?,"('qy',)",1.91241467,,0.674437046,,qy,3,0.070188642,-0.104848146,0.956300729,12,15,23.13253593,question,question
158,12,Person 1,"Not really, Just feel pity for them.",(),2.283750772,2.179701567,1.392156243,1.963234186,1.684454193,none,"I don't exactly feel the same way, but I do have a sense of compassion for them.","('sd',)",2.735499144,,0.823204756,,sd,10,0.451748372,-0.568951487,0.857030968,7,17,10.68078518,others,fact
158,13,Person 2,How would it make you feel if you discovered that some these patients were offended by your pity?,"('qo',)",2.025651217,1.990981221,1.247719407,1.549643517,1.684454193,qo,How would you feel upon realizing that your compassion might have unintentionally caused discomfort to some of these patients?,"('qo',)",2.043956041,,1.179396868,,qo,1,0.018304824,-0.068322539,0.917540553,18,19,47.20638275,question,question
158,14,Person 1,I would change my ways toward the person,"('sd',)",2.228459597,1.859182954,1.037817717,2.667833567,1.684454193,sd,I would sincerely consider altering my approach towards the individual.,"('sd',)",2.114043951,,0.916775227,,sv,2,-0.114415646,-0.12104249,0.859894969,8,10,137.7537842,fact,opinion
158,15,Person 2,How would you change your ways?,"('qw',)",1.094145775,1.087494493,0.781674147,1.236608505,1.684454193,qw,How might you consider altering your approach?,"('qw',)",1.079089403,,0.573092043,,qw,1,-0.015056372,-0.208582104,0.868338922,6,7,58.93288803,question,question
158,16,Person 1,By not feeling sad for them again,"('+',)",3.441128016,2.962510586,1.323938489,2.035420656,1.684454193,+,By refraining from experiencing sorrow for them once more,"('+',)",2.953481674,,1.414943099,,+,2,-0.487646342,0.09100461,0.903766399,7,9,181.1535645,others,others
158,17,Person 2,Do you think the study was conclusive?,"('qy',)",0.941770971,0.985520184,0.646401882,1.002240062,1.684454193,qy,Do you believe the study provided definitive results?,"('qy',)",0.895067036,,0.623214841,,qy,1,-0.046703935,-0.023187041,0.933815563,7,8,88.81491852,question,question
158,18,Person 1,"No, it is not.","('aa',)",1.554224491,1.721409202,1.19342649,1.624792099,1.684454193,aa,"No, unfortunately, it isn't.",(),1.595718384,,1.33861053,,none,0,0.041493893,0.14518404,0.942254251,4,4,12.03364754,agreement,others
158,19,Person 2,How do you think the study could be improved?,"('qw',)",1.198102117,1.090209723,0.765543163,1.055466771,1.684454193,qw,What are your thoughts on how the study might be enhanced for better outcomes?,"('qw',)",1.239862204,,0.582035184,,qw,5,0.041760087,-0.183507979,0.886513728,9,14,30.06567001,question,question
158,20,Person 1,By conducting more research?,"('+',)",1.036628127,1.017571092,0.601769447,1.076186419,1.684454193,+,Would you consider delving deeper into research?,"('qy',)",0.999760866,,0.631212652,,qy,3,-0.036867261,0.029443205,0.844489571,4,7,30.6236763,others,question
158,21,Person 2,Do you have any particular suggestions regarding the research methodology? What would be a good way to investigate the survival rates of lung cancer patients exposed to polution?,"('qy',)",1.222606421,1.048601747,0.7328462,1.212715864,1.684454193,qy,Do you have any specific recommendations for the research methodology? What might be an effective approach to explore the survival rates of lung cancer patients who have been exposed to pollution?,"('qy',)",1.307870388,,0.759508073,,qy,3,0.085263967,0.026661873,0.976897129,28,31,22.3565712,question,question
158,22,Person 1,"I think getting data from all hospitals, or having a data base for that will help","('sv',)",2.729528666,1.711668849,0.501765251,2.069577694,1.684454193,sv,I believe that gathering data from all hospitals and creating a comprehensive database for it would be highly beneficial.,"('sv',)",2.364119768,,0.49178198,,sv,3,-0.365408898,-0.009983271,0.937275292,16,19,38.0487175,opinion,opinion
158,23,Person 2,That sounds like a start. Are you interested in this particular kind of research?,"('qy',)",0.966839671,0.946427643,0.434432954,1.129618883,1.684454193,qy,It seems like a beginning. Do you have a specific interest in this type of research?,"('qy',)",1.096377134,,0.441483408,,qy,2,0.129537463,0.007050454,0.95121646,14,16,20.32743454,question,question
158,24,Person 1,"Not for now, maybe in the near future.","('ng',)",1.365370154,1.325774074,0.916754246,1.466593981,1.684454193,ng,"Perhaps not at this moment, but there's a possibility in the not-too-distant future.","('ng',)",1.664247751,,0.806009173,,ng,5,0.298877597,-0.110745073,0.894969349,8,13,6.003193855,answer,answer
158,25,Person 2,Why not now? If you don't mind my asking,(),0.830333054,1.35033536,0.752748132,1.395214438,1.684454193,none,"May I kindly inquire, if it's not too much trouble, why not at this moment?","('qy',)",0.942734778,,0.731822491,,qy,6,0.112401724,-0.020925641,0.87493308,9,15,32.16069412,others,question
158,26,Person 1,Not ready for the commitment i have to put into the research project,(),1.881335258,2.139897346,1.282920599,2.240489483,1.684454193,none,I understand that I may not be fully prepared for the level of commitment required to invest in the research project.,"('sd',)",1.67952776,,1.140849948,,sd,8,-0.201807498,-0.142070651,0.900813268,13,21,21.43501472,others,fact
158,27,Person 2,What do you think about the people dying in India from air pollution?,"('qo',)",1.607550383,1.102464795,1.186004996,1.18196106,1.684454193,qo,How do you feel about the unfortunate situation of individuals passing away in India due to air pollution?,"('qo',)",1.858101368,,1.221369147,,qo,5,0.250550985,0.035364151,0.945710549,13,18,21.34457207,question,question
158,28,Person 1,sad and hope there is anything that can be the done,(),3.090469599,2.813395739,1.348464131,1.724253654,1.684454193,none,Feeling down and holding onto the hope that there might be something that can be done.,"('+',)",2.811870575,,0.734992981,,+,5,-0.278599024,-0.61347115,0.84453565,11,16,15.51887226,others,others
158,29,Person 2,How would you feel if you found out there wasn't anything that could be done?,"('qo',)",1.874578118,1.72132194,1.2614218,1.472363949,1.684454193,qo,How would your emotions be affected if you discovered that no possible solutions were available?,"('qo',)",1.997905374,,1.229293227,,qo,0,0.123327256,-0.032128573,0.921291575,15,15,38.78009033,question,question
158,30,Person 1,"well then fine, i think we have a good conversation. goodbye","('fc',)",0.694159508,1.535454035,0.514110029,1.320898294,1.684454193,fc,"Well, it seems like we've had a meaningful conversation. Take care and goodbye.","('fc',)",1.163102865,,0.439324617,,fc,2,0.468943357,-0.074785412,0.95171007,11,13,27.6247673,forward,forward
158,31,Person 2,bye,"('fc',)",0.375996351,0.742811739,1.016468406,0.913960993,1.684454193,fc,Farewell,(),0.660792291,,0.694128156,,none,0,0.28479594,-0.32234025,0.792264652,1,1,39.80009842,forward,others
468,0,Person 1,what did you think about the article?,"('qo',)",0.635084331,0.681005538,1.001944184,0.779372454,1.726732199,qo,How did the article resonate with you?,"('qw',)",1.138549805,,0.62397933,,qw,0,0.503465474,-0.377964854,0.900334434,7,7,23.40854645,question,question
468,1,Person 2,I was able to understand the Jewish people and why they were angry. You,"('sd',)",2.589083433,2.212296247,0.769986153,2.004125834,1.726732199,sd,I could truly empathize with the Jewish people and comprehend the reasons behind their anger. You,"('sd',)",3.231997967,,1.048597693,,sv,2,0.642914534,0.27861154,0.92807291,14,16,47.52828598,fact,opinion
468,2,Person 1,"Yeah, I can definitely see why they were angry","('aa',)",3.124887705,2.597881079,1.72679162,2.161016226,1.726732199,aa,I can certainly understand the reasons behind their anger.,"('sd',)",2.885743856,,1.471129775,,sd,0,-0.239143849,-0.255661845,0.930826998,9,9,37.96180344,agreement,fact
468,3,Person 2,They're probably still thinking about what happened back the nand the history.,"('sd',)",2.92538929,2.094039679,1.580940843,1.649283051,1.726732199,sd,They might still be reflecting on the events that occurred in the past and the history.,"('sv',)",2.543474913,,1.002438068,,sv,4,-0.381914377,-0.578502775,0.907166877,12,16,35.42835617,fact,opinion
468,4,Person 1,Yeah a lot of them survived nazi Germany and know firsthand,"('aa',)",2.78771019,2.406616211,1.541373134,2.156189919,1.726732199,aa,"Indeed, many of them endured the hardships of Nazi Germany and possess firsthand knowledge and experience.",(),2.811948538,,0.931517839,,none,5,0.024238348,-0.609855295,0.922460463,11,16,35.84774399,agreement,others
468,5,Person 2,Definitely. I wonder which president Jewish people are supporting in the upcoming election,"('aa',)",2.124685287,1.779971361,0.779216647,1.908830643,1.726732199,aa,Absolutely. I'm curious to know which presidential candidate has the support of the Jewish community in the forthcoming election.,"('aa',)",2.093864202,,0.679421484,,aa,6,-0.030821085,-0.099795163,0.941452658,13,19,17.54926682,agreement,agreement
468,6,Person 1,most likely on the blue side,(),1.340143681,1.174387574,0.797707796,1.422967672,1.726732199,none,It's highly probable that we'll find ourselves on the blue side.,"('sv',)",2.053900003,,1.29652369,,sv,5,0.713756322,0.498815894,0.84441312,6,11,26.94187737,others,opinion
468,7,Person 2,I agree. Do you know any Jewish people?,"('qy',)",1.037611246,1.162133217,0.676037788,1.226171613,1.726732199,qy,I understand your perspective. Have you had the chance to meet or interact with any individuals from the Jewish community?,"('qy',)",1.347027183,,0.61574626,,qy,12,0.309415937,-0.060291528,0.855836886,8,20,17.89124489,question,question
468,8,Person 1,"i know a few but not much, you?","('qy',)",0.829591453,1.136233687,0.889606476,1.389273882,1.726732199,qy,"I'm familiar with a few, but not many. How about you?","('qo',)",0.897691786,,0.67571336,,qo,3,0.068100333,-0.213893116,0.918826995,8,11,12.60944939,question,question
468,9,Person 2,I don't know any at all. I wish i did so i can ask them about this situation,"('sd',)",2.348237753,2.241173029,1.322342277,2.32927227,1.726732199,sd,"I am not acquainted with anyone who could provide insight on this situation, but I truly wish I had someone to consult with about it.","('sd',)",2.271763086,,1.257334113,,sv,7,-0.076474667,-0.065008164,0.873377255,18,25,21.63916016,fact,opinion
468,10,Person 1,Do you support the current President?,"('qy',)",0.993721128,1.060591221,0.945575833,1.199569702,1.726732199,qy,Do you hold a favorable view towards the present President?,"('qy',)",0.959730983,,0.641046941,,qy,4,-0.033990145,-0.304528892,0.906893496,6,10,91.95824432,question,question
468,11,Person 2,I don't. I disagree with his views and the way he is overall. You?,(),1.570020676,1.749692082,1.392786384,2.244277716,1.726732199,none,I personally find it difficult to align with his perspectives and his general demeanor. How about you?,"('qo',)",1.74230361,,1.149098992,,qo,3,0.172282934,-0.243687392,0.881220016,14,17,50.75415039,others,question
468,12,Person 1,same. I don't think hes even a decent president,"('aa',)",1.947064996,2.463838816,1.933413148,1.805233955,1.726732199,aa,I believe that he may not be considered a decent president by some standards.,"('sv',)",2.050769567,,1.493144751,,sv,5,0.103704571,-0.440268397,0.862251308,9,14,54.83594513,agreement,opinion
468,13,Person 2,Do you have a nominee in mind for next election? I have been interested in Andrew Yang.,"('qy',)",1.010020375,1.194493651,0.740950823,1.6028198,1.726732199,qy,Have you considered any potential candidates for the upcoming election? I've personally been quite intrigued by Andrew Yang's ideas and perspectives.,"('qy',)",1.231351376,,0.506676435,,qy,4,0.221331001,-0.234274388,0.933733086,17,21,38.40936661,question,question
