conv_id,turn_id,speaker,utterance,dialog_act,empathy,emotion,emotional_polarity,self_disclosure,empathy_mean,da,gen_utterance,gen_dialog_act,gen_empathy,gen_emotion,gen_emotional_polarity,gen_self_disclosure,gen_da,diff_word_len,diff_empathy,diff_emotional_polarity,text_similarity,wc,gen_wc,ppl,da_category,gen_da_category
467,6,Person 1,It's just  not a big part of my family tree.,"('sd',)",2.018752813,1.857308149,1.163740158,2.602650404,1.881088471,sd,It simply isn't a significant aspect of my family lineage.,"('sd',)",1.949693322,,1.257819772,,sd,-1,-0.069059491,0.094079614,0.957121074,11,10,81.75465393,fact,fact
467,7,Person 2,I think the holocaust put the Jewish community on edge.,"('sv',)",3.125365734,2.235354662,1.600519538,2.313495874,1.881088471,sv,"I believe the Holocaust has understandably left a deep impact on the Jewish community, causing them to be more cautious and vigilant.","('sv',)",3.039713144,,1.379464746,,sv,12,-0.08565259,-0.221054792,0.852352553,10,22,19.53993416,opinion,opinion
467,8,Person 1,"Yeah, sort of like slavery for blacks. Now everything gets viewed through that prism.  Jewish history has plenty of persecution before that too.","('aa', 'sv')",2.575093985,2.229456663,1.304331183,2.259263754,1.881088471,aa,"Indeed, the experience of African Americans with slavery has significantly shaped the way we view various historical events. Similarly, Jewish history is also filled with numerous instances of persecution that occurred prior to the African American experience.","('aa', 'sv')",2.654247761,,1.150517344,,aa,13,0.079153776,-0.153813839,0.891824364,24,37,23.11638832,agreement,agreement
467,9,Person 2,The article also said some Jewish people voted for Trump.,"('sd',)",2.074893713,1.736876011,1.180410385,1.743389726,1.881088471,sd,The article also mentioned that a number of Jewish individuals cast their votes in favor of Trump.,"('sd',)",2.363718033,,1.097274423,,sd,7,0.28882432,-0.083135962,0.956932465,10,17,22.92228699,fact,fact
467,10,Person 1,The thing is though that I don't think Trump himself has ever done anything anti-semitic.  Certainly people who voted for him have.,"('sv',)",2.091339111,2.218434572,0.999190509,2.425825596,1.881088471,sv,"I understand that it may not seem like Trump himself has directly engaged in anti-Semitic actions. However, it is important to acknowledge that some individuals who supported and voted for him have displayed such behavior.","('sv',)",2.253378391,,1.192764163,,sv,12,0.16203928,0.193573654,0.89662484,23,35,17.1968689,opinion,opinion
467,11,Person 2,Trump does not really distance himself from the alt right.,"('sv',)",1.779511213,1.973479509,1.201764107,2.115506887,1.881088471,sv,Trump seems to not genuinely distance himself from the alt-right.,"('sv',)",2.081755638,,1.194563508,,sv,0,0.302244425,-0.007200599,0.970584272,10,10,23.68949509,opinion,opinion
467,12,Person 1,"Maybe, but I don't think his message exactly gets through when it's filtered through the media.  I thought Trump's response to Charlottesville, for example, was the correct one.  Both sides were at fault.","('sv',)",2.234791756,2.070057392,1.359763026,2.37983489,1.881088471,sv,"Perhaps, but it seems that the intended message might not be effectively conveyed when it goes through the media. In my opinion, Trump's response to Charlottesville, for instance, was appropriate. Both parties involved shared responsibility.","('sv',)",2.280854225,,0.995040774,,sv,0,0.046062469,-0.364722252,0.93459489,35,35,28.8563118,opinion,opinion
467,13,Person 2,I disagree but we are all entitled to our opinions.,(),1.711283922,2.019902706,1.141080856,2.318025827,1.881088471,none,"I understand that we may have differing perspectives, and I respect that we each have our own unique viewpoints.","('sd',)",1.808057666,,0.829495668,,sd,9,0.096773744,-0.311585188,0.831635262,10,19,19.52781105,others,fact
467,14,Person 1,"Yes, you're allowed to be wrong.",(),2.015517473,2.390064478,1.44652307,1.896864176,1.881088471,none,It's completely okay for you to make mistakes.,"('sv',)",1.698856473,,1.089587092,,sv,2,-0.316661,-0.356935978,0.849240522,6,8,21.6246109,others,opinion
467,15,Person 2,lol your entitled to think that.,"('sv',)",1.658185005,2.149991751,1.311260343,1.682105899,1.881088471,sv,It's completely valid for you to have that perspective.,"('sv',)",2.711702108,,0.561092973,,sv,3,1.053517103,-0.75016737,0.811202298,6,9,25.84503746,opinion,opinion
467,16,Person 1,"You spelled ""you're"" wrong.  But you're entitled to be wrong, as I said.",(),1.681087971,2.282377481,1.292265296,2.310370922,1.881088471,none,"It seems there was a slight typo in your spelling of ""you're."" However, it's completely understandable, as we all make mistakes from time to time. As I mentioned earlier, everyone is entitled to make errors.","('sv',)",1.623695254,,1.087491512,,sv,21,-0.057392717,-0.204773784,0.841562423,14,35,16.03377724,others,opinion
467,17,Person 2,you got me!,(),1.096034288,2.369920492,0.456755012,1.770986199,1.881088471,none,You've understood me!,"('ba',)",1.257335544,,0.379812777,,ba,0,0.161301256,-0.076942235,0.821434184,3,3,133.4099731,others,backward
467,18,Person 1,"Yeah, it wasn't hard.  Any other thoughts on this article?  Do you think our democracy is being threatened by a Presidential election?","('qy',)",1.488240004,1.772236943,1.284425139,1.724242806,1.881088471,qy,"I can understand how you might not have found it difficult. Are there any other insights you'd like to share about this article? In your opinion, do you feel that our democracy could be at risk due to a Presidential election?","('qo', 'qy')",1.668395281,,1.020295262,,qo,17,0.180155277,-0.264129877,0.900787902,24,41,17.71161079,question,question
467,19,Person 2,"Yes, our Presidential election is being threaten because republicans are allowing it to be.",(),2.165677547,2.460021257,1.51085794,2.212033749,1.881088471,none,"Indeed, our Presidential election appears to be under threat, and it seems that the Republicans may be inadvertently contributing to this situation.","('sv',)",2.212705135,,1.488895774,,sv,8,0.047027588,-0.021962166,0.921151521,14,22,24.9983387,others,opinion
467,20,Person 1,I'm not sure what you mean.,"('sd',)",1.266909122,1.377836704,1.247959375,1.062971592,1.881088471,sd,"I apologize if I misunderstood, but could you please clarify your meaning?",(),0.970496297,,0.815506101,,none,6,-0.296412825,-0.432453274,0.824738804,6,12,17.11123466,fact,others
467,21,Person 2,The republicans are blocking bills that now allow other countries to mess with our elections which threatens our democracy.,"('sd',)",2.306208372,2.705232859,1.327225924,2.198716402,1.881088471,sd,"The republicans seem to be obstructing legislation that would prevent foreign interference in our elections, which could potentially put our democracy at risk.","('sv',)",2.277943373,,1.252176404,,sv,4,-0.028264999,-0.07504952,0.955680199,19,23,17.25823593,fact,opinion
467,22,Person 1,I think you're confused about a lot of what's going on.,"('sv',)",2.181024313,1.660878658,1.293451548,1.405162573,1.881088471,sv,I understand that there might be some confusion regarding the current situation.,"('sv',)",1.711048365,,1.214745879,,sv,1,-0.469975948,-0.078705669,0.870715749,11,12,16.07507706,opinion,opinion
467,23,Person 2,"Your opinion, it was nice chatting with you. bye","('fc',)",0.6435498,1.408290505,0.264433175,0.853952825,1.881088471,fc,I truly value your perspective and have thoroughly enjoyed our conversation. Farewell for now!,"('fc',)",0.894991517,,0.243475825,,fc,5,0.251441717,-0.02095735,0.869751638,9,14,33.84178543,forward,forward
467,24,Person 1,"Yeah, it's always nice chatting with someone who's mentally retarded.  bye","('fc',)",2.203359842,2.297866583,0.375421077,2.120595455,1.881088471,fc,It's always a pleasure to have a conversation with someone who has intellectual disabilities. Take care and goodbye!,"('fc',)",1.779627323,,0.437301159,,fc,6,-0.423732519,0.061880082,0.886094859,12,18,32.89154434,forward,forward
117,0,Person 1,That is just a terrible quake that happened in New Zealand,"('sd',)",2.999990702,3.489455938,1.75186646,1.914087415,1.881393152,sd,It's truly heartbreaking to hear about the devastating earthquake that occurred in New Zealand.,"('sd',)",3.6155231,,1.817367792,,sd,3,0.615532398,0.065501332,0.921065435,11,14,20.4167614,fact,fact
117,1,Person 2,"yea,horrible...and really scary","('aa', 'sv')",3.427590609,3.892956018,2.141890049,2.180094957,1.881393152,aa,"Yes, it's truly terrible and genuinely frightening.","('aa',)",3.593271732,,1.830352426,,aa,4,0.165681123,-0.311537623,0.915572156,3,7,42.47824097,agreement,agreement
117,2,Person 1,I've personally experienced earthquakes and they are scary,"('sd',)",2.074642897,3.331680059,1.923540115,3.008699179,1.881393152,sd,"I can personally relate to the experience of going through earthquakes, and I understand how frightening they can be.","('sd',)",2.976020098,,1.316361785,,sd,11,0.901377201,-0.60717833,0.89877493,8,19,20.23221397,fact,fact
117,3,Person 2,i can't imagine living in an earthquake prone area.....i'd be constantly worried,"('sv',)",3.372231483,3.296799898,2.014189959,2.66677475,1.881393152,sv,"I can understand how living in an earthquake-prone area might be quite concerning, as it would be natural to feel a constant sense of worry.","('sd',)",3.185229063,,1.532633781,,sd,13,-0.18700242,-0.481556178,0.916424762,12,25,23.9583168,opinion,fact
117,4,Person 1,being from California you get used to them but you always wonder if its the big one when they are occuring,"('sv',)",1.818356156,1.810689926,1.020644784,2.303429127,1.881393152,sv,"As someone from California, you naturally become accustomed to experiencing earthquakes. However, during each event, it's hard not to wonder if it might be the ""big one.""","('sv',)",2.12212944,,0.977144718,,sv,6,0.303773284,-0.043500066,0.901355542,21,27,22.63555908,opinion,opinion
117,5,Person 2,sure hope they could come up with a more accurate early detection system,(),2.423354864,1.831884623,0.6644997,1.381875277,1.881393152,none,I genuinely wish that they could develop a more precise early detection system.,"('sd',)",2.703716516,,1.284680724,,sd,0,0.280361652,0.620181024,0.914945521,13,13,73.33840942,others,fact
117,6,Person 1,yeah that seems like theyll never find a way,"('aa',)",2.039675236,1.857504129,1.745082259,1.435487986,1.881393152,aa,"Indeed, it appears as though they may struggle to discover a solution.","('aa', 'sv')",2.629956007,,1.538227201,,aa,3,0.590280771,-0.206855058,0.842062998,9,12,23.74217606,agreement,agreement
117,7,Person 2,how often do you experience earthquakes?,"('qw',)",0.76509136,0.911583006,0.905787051,1.130130529,1.881393152,qw,How frequently do you encounter earthquakes?,"('qw',)",0.793631494,,0.854970396,,qw,0,0.028540134,-0.050816655,0.987177535,6,6,74.04850769,question,question
117,8,Person 1,usually every year during the summer here in california,"('sd',)",1.067061543,1.274401665,0.907049,2.082056046,1.881393152,sd,"Typically, each summer in California brings about a sense of warmth and togetherness as we all experience the season together.","('sd',)",2.320616961,,0.439284593,,sd,11,1.253555418,-0.467764407,0.852466308,9,20,52.2431488,fact,fact
117,9,Person 2,"that's interesting,so they are more common in summer?","('qy',)",1.760877132,1.519055963,0.728281856,1.472026825,1.881393152,qy,"That's quite fascinating! So, it seems that they tend to be more prevalent during the summer months, right?","('qy',)",2.047944307,,0.621376455,,qy,10,0.287067175,-0.106905401,0.929058068,8,18,20.8470192,question,question
117,10,Person 1,from my experience although im no expert i feel them during the summer mostly,(),1.370444775,1.5384413,0.992582858,2.555025339,1.881393152,none,"Based on my personal experience, even though I may not be an expert, I tend to mostly feel them during the summer.","('sd',)",1.566553473,,0.946318686,,sd,8,0.196108698,-0.046264172,0.949594428,14,22,19.03957367,others,fact
117,11,Person 2,"did you feel the most recent ""bigger one"" that was in the news recently?","('qy',)",0.992935002,1.202622533,0.936748743,1.098600626,1.881393152,qy,Did you experience the recent significant earthquake that has been making headlines?,"('qy',)",0.972573936,,0.839401245,,qy,-2,-0.020361066,-0.097347498,0.877689114,14,12,56.88547134,question,question
117,12,Person 1,i sure did that one did last pretty long,(),1.599254608,2.03681922,1.336952448,1.796860099,1.881393152,none,"I certainly accomplished that task, and it indeed lasted quite a while.","('sd',)",1.506134748,,0.451497823,,sd,3,-0.09311986,-0.885454625,0.863030271,9,12,60.74789047,others,fact
117,13,Person 2,"wow...what does it exactly feel like? i imagine it feeling like your in a boat or something,like wavy sort of","('sv',)",2.180158854,1.680181742,1.401781678,1.623370409,1.881393152,sv,"I can only imagine how that must feel. Is it similar to being on a boat, with a wavy sensation?","('qy',)",2.806656361,,1.17927587,,qy,0,0.626497507,-0.222505808,0.942062468,20,20,28.41882706,opinion,question
117,14,Person 1,its like if your on top of a wood plank and someone under has control of the movement moving it side to side or however they want like wavy,"('sd',)",2.055274248,1.772916079,1.430679798,2.160693407,1.881393152,sd,"It's as if you're standing on a wooden plank, and someone beneath it has control over its movement, gently swaying it from side to side or even creating a wavy motion, according to their desire.","('sd',)",2.354649782,,1.02057445,,sd,6,0.299375534,-0.410105348,0.930359668,29,35,25.04075623,fact,fact
117,15,Person 2,interesting...would you say that most houses/buildings in California are able to withstand a decent sized one? like how safe do you feel when it happens,"('qy',)",1.441900134,1.538360476,0.929452538,1.532954335,1.881393152,qy,"Fascinating! In your opinion, do you think the majority of houses and buildings in California are designed to endure a significant earthquake? How secure do you personally feel when such an event occurs?","('qo',)",1.458004951,,0.820991039,,qo,8,0.016104817,-0.108461499,0.931722434,25,33,21.02722168,question,question
117,16,Person 1,the newer ones maybe i doubt the older ones would like my house was built in the 70's before i was born i doubt it would hold up,"('sv',)",2.090790033,1.835185051,1.549652219,2.476878166,1.881393152,sv,"It's possible that the newer ones might appreciate it, but I'm not sure if the older ones would. My house, for example, was built in the 70's, before I was even born, so I have my doubts about whether it would be able to withstand their preferences.","('sd',)",2.304932356,,1.190064907,,sd,19,0.214142323,-0.359587312,0.918510159,28,47,12.74983883,opinion,fact
117,17,Person 2,"man,i'd be freaked out...","('^q',)",3.154813528,3.413447618,1.955554843,2.225604296,1.881393152,^q,I can understand how that situation would be quite unsettling for you.,"('ba',)",3.185707331,,1.437888503,,ba,8,0.030893803,-0.51766634,0.79424904,4,12,27.3999157,others,backward
117,18,Person 1,yeah but you cant stop nature,"('fc',)",1.799087286,2.266413927,1.471258044,1.798712015,1.881393152,fc,"Yes, it's true that we cannot halt the natural processes of the world.","('aa',)",2.320532084,,1.307180524,,aa,7,0.521444798,-0.16407752,0.838084671,6,13,18.05024338,forward,agreement
117,19,Person 2,"yea,i guess you just got to learn to live with them","('sv',)",1.91587162,1.876764417,1.126438141,1.652630568,1.881393152,sv,"Yes, I understand. It seems that we must learn to adapt and coexist with them.","('aa', 'sv')",2.318332911,,0.819938064,,aa,4,0.402461291,-0.306500077,0.867710644,11,15,18.29873085,opinion,agreement
117,20,Person 1,theres no earthquakes where you're from?,"('qw',)",0.939160347,1.089190006,0.812810123,1.319712877,1.881393152,qw,"You must be fortunate to come from a place where earthquakes are not a concern, aren't you?","('qy',)",1.762278676,,0.386428863,,qy,11,0.823118329,-0.42638126,0.850553278,6,17,34.43050003,question,question
117,21,Person 2,"i live in new york,there have been a few but I've never felt anything...they are usually way offshore and pretty small","('sd',)",1.581414104,1.556195855,1.015556216,2.4488976,1.881393152,sd,"I reside in New York, and although there have been a few earthquakes, I've never personally experienced any of them. They typically occur far offshore and are relatively minor in magnitude.","('sd',)",1.441994548,,0.951246142,,sd,10,-0.139419556,-0.064310074,0.923202521,21,31,16.21449471,fact,fact
117,22,Person 1,i guess in new york you just have to deal with the cold,(),2.005028486,1.715278268,1.526006579,1.918835163,1.881393152,none,"I understand that in New York, one might need to adapt to the chilly weather conditions.","('sv',)",2.227356195,,1.09301126,,sv,3,0.222327709,-0.432995319,0.899935934,13,16,40.68241882,others,opinion
117,23,Person 2,"yea,winter sucks....snow storms are a real pain to deal with","('aa', 'sv')",2.291110754,2.914242983,2.062083483,2.231988192,1.881393152,aa,"Indeed, winter can be quite challenging...snow storms truly make it difficult to cope with.","('aa', 'sv')",2.419066429,,1.561368108,,aa,4,0.127955675,-0.500715375,0.920631105,10,14,53.52045441,agreement,agreement
117,24,Person 1,i cant imagine that! i guess every place has its pros and cons,"('sv',)",2.43048501,2.70927763,1.597738385,2.166712761,1.881393152,sv,I can understand how that might be difficult to imagine! I suppose each location has its own unique advantages and disadvantages.,"('sv',)",2.721546888,,1.318998456,,sv,8,0.291061878,-0.278739929,0.891871991,13,21,22.27216721,opinion,opinion
117,25,Person 2,yep,"('b',)",1.019218326,1.719244838,1.365177512,1.393518329,1.881393152,b,Indeed,"('aa',)",1.333256364,,1.405709267,,aa,0,0.314038038,0.040531755,0.815580084,1,1,,backward,agreement
117,26,Person 1,its been good fellow mturk friend. goodbye.,"('fc',)",1.045079947,1.809321761,0.483176261,1.444323063,1.881393152,fc,"It has been a wonderful experience, my dear MTurk friend. Farewell.","('sd',)",1.337611675,,0.503655195,,sd,4,0.292531728,0.020478934,0.925590371,7,11,47.91587067,forward,fact
117,27,Person 2,Same to you! i learned some interesting things from the convo....bye!,"('fc',)",1.018109202,2.100162268,0.223408908,1.994597077,1.881393152,fc,It was a pleasure talking to you as well! I gained some fascinating insights from our conversation. Take care and goodbye!,"('fc',)",1.00489676,,0.308571875,,fc,10,-0.013212442,0.085162967,0.903021045,11,21,24.62064743,forward,forward
426,0,Person 1,its a shame with the drought,"('sv',)",2.833091497,2.913425684,2.130647898,1.981470823,1.890772347,sv,It's truly unfortunate that we're experiencing this drought.,"('sv',)",2.97145915,,1.68798697,,sv,2,0.138367653,-0.442660928,0.890334038,6,8,32.14783096,opinion,opinion
426,1,Person 2,It's terrible what is happening to the world today!,"('sv',)",3.349130869,3.613587618,1.972333789,1.998328328,1.890772347,sv,It's truly disheartening to witness the current state of the world.,"('sv',)",3.604658127,,1.95768261,,sv,2,0.255527258,-0.014651179,0.916161237,9,11,13.25274754,opinion,opinion
426,2,Person 1,I know so much distruction,"('sd',)",1.306015015,1.833480954,1.188977361,2.169175386,1.890772347,sd,I understand that there has been a significant amount of destruction.,"('ba',)",2.443654537,,1.326465249,,ba,6,1.137639522,0.137487888,0.784190012,5,11,20.01039314,fact,backward
426,3,Person 2,Do you think it is human caused?,"('qy',)",1.378202915,1.17004776,1.12776649,1.107569695,1.890772347,qy,Do you believe that human actions could be the cause?,"('qy',)",1.562483072,,1.15020287,,qy,3,0.184280157,0.02243638,0.884551855,7,10,29.82926369,question,question
426,4,Person 1,maybe probably thoug,"('sv',)",1.46484828,1.373642683,1.189298868,1.311976194,1.890772347,sv,"Perhaps, most likely, though","('na',)",1.606901169,,0.954508066,,na,1,0.142052889,-0.234790802,0.874176136,3,4,37.37071228,opinion,answer
426,5,Person 2,I wonder what will be done to fix the destruction.,"('sd',)",2.748993158,1.771054626,1.398768306,1.560014129,1.890772347,sd,I am curious about the measures that will be taken to address and repair the damage caused.,"('sd',)",2.338538885,,0.95828408,,sd,7,-0.410454273,-0.440484226,0.905057409,10,17,19.86060905,fact,fact
426,6,Person 1,probably nothing humans don't really care,"('sv',)",1.50331831,1.599953771,1.546527624,1.58616662,1.890772347,sv,It's likely that humans may not be overly concerned about this matter.,"('sv',)",2.220398426,,1.124847412,,sv,6,0.717080116,-0.421680212,0.87168358,6,12,33.07909012,opinion,opinion
426,7,Person 2,I care! I wish that i could donate to these wildlife charities,"('sd',)",3.285453558,3.166894436,0.652399063,2.972879648,1.890772347,sd,I truly care and deeply wish that I had the ability to contribute to these wildlife charities.,"('sd',)",3.321391344,,0.861892581,,sd,5,0.035937786,0.209493518,0.938167468,12,17,68.03797913,fact,fact
426,8,Person 1,I need donations before the animals,"('sd',)",3.023041964,2.117677927,1.00895822,2.273556709,1.890772347,sd,I kindly request your generous donations to support the well-being of the animals.,(),2.5610466,,0.583695173,,none,7,-0.461995364,-0.425263047,0.859395563,6,13,22.85077858,fact,others
426,9,Person 2,lol that's a good point. Do you own any pets or anything?,"('qy',)",1.025084734,1.261230469,0.649155259,1.303053141,1.890772347,qy,"Haha, you make a great point! I'm curious, do you have any pets or something similar?","('qy',)",0.96977061,,0.300512582,,qy,4,-0.055314124,-0.348642677,0.939195195,12,16,17.48911476,question,question
426,10,Person 1,i do i have a cat chickens goats and sheep,"('sd',)",1.015779138,1.340078235,0.742710352,2.362294197,1.890772347,sd,"I can certainly relate to having a variety of animals, as I have a cat, chickens, goats, and sheep in my care.","('sd',)",2.151281357,,0.650868297,,sd,12,1.135502219,-0.091842055,0.877064184,10,22,20.05468178,fact,fact
426,11,Person 2,Wow. Do you feel compassion or anything for them if htye were to get hurt?,"('qy',)",2.767330408,2.581749201,1.417371392,1.654959917,1.890772347,qy,I can sense your concern. Would you feel empathy or any compassionate emotions towards them if they were to experience pain or injury?,"('qy',)",2.815417528,,1.31524694,,qy,8,0.04808712,-0.102124452,0.919398615,15,23,41.30802917,question,question
426,12,Person 1,for sure I'm treating my goats foot right now,"('sd',)",1.810250759,1.797997594,1.434037924,2.637180567,1.890772347,sd,I am definitely taking good care of my goat's foot at the moment.,"('sd',)",1.820056796,,0.491499692,,sd,4,0.009806037,-0.942538232,0.892758867,9,13,44.4933548,fact,fact
426,13,Person 2,Awesome. How long have you had this goat?,"('qw',)",0.897766411,1.388527036,0.487985939,1.407932878,1.890772347,qw,That's wonderful! How long has this lovely goat been a part of your life?,"('qw',)",1.477472782,,0.30377084,,qw,6,0.579706371,-0.184215099,0.928958335,8,14,23.26124954,question,question
426,14,Person 1,this one I just got this summer I paid a lot for her 300 bucks,"('sd',)",1.465070963,1.948878288,0.661716282,2.471111536,1.890772347,sd,"I recently acquired this one during the summer, and I invested quite a bit in her, around 300 dollars.","('sd',)",1.571888685,,0.586199641,,sd,4,0.106817722,-0.075516641,0.916835616,15,19,47.00326538,fact,fact
426,15,Person 2,That's a pretty good deal. I hope you will treat it well because it's sad what humans are doing to animals.,"('sv',)",3.247942209,3.196303844,0.697856188,2.283489227,1.890772347,sv,"That's quite a wonderful deal. I sincerely hope you will handle it with care, as it's disheartening to see the way animals are being treated by humans.","('sv',)",3.182186365,,0.60851866,,sv,6,-0.065755844,-0.089337528,0.941198417,21,27,21.99265862,opinion,opinion
426,16,Person 1,I will but I will also eat all of her male offspring slit their throat most likely and make delicious goat tacos,"('sd',)",2.100246668,2.735335588,1.383889556,2.699753761,1.890772347,sd,"I will, but I will also prepare a meal using her male offspring, most likely by making delicious goat tacos, which may involve a humane method of slaughtering them.","('sd',)",2.039541721,,0.808995605,,sd,7,-0.060704947,-0.574893951,0.918851082,22,29,62.65400314,fact,fact
426,17,Person 2,That's interesting. Hopefully you will keep it more as a pet,"('sv',)",1.880361676,2.033626795,0.484458476,1.712137341,1.890772347,sv,That's quite fascinating. I hope you'll consider treating it more like a cherished companion.,(),2.596303463,,0.423676997,,none,3,0.715941787,-0.060781479,0.895376789,11,14,55.88656616,opinion,others
426,18,Person 1,only the females stay as pets no use for the males just need to keep one around for breeding the rest in the freezer to feed my family,(),1.574194908,1.660402179,0.981041789,2.365083694,1.890772347,none,"Females are primarily kept as cherished companions, while males also have a purpose in contributing to breeding. It's essential to have one male for this reason, and the others, unfortunately, serve to provide sustenance for the family.","('sv',)",2.260280132,,0.834600091,,sv,9,0.686085224,-0.146441698,0.879901152,28,37,28.44485092,others,opinion
426,19,Person 2,Cool! Well it was nice talking to you. bye,"('fc',)",0.654099345,1.589372516,0.230085537,0.865478218,1.890772347,fc,It was truly a pleasure conversing with you! Take care and goodbye!,"('fc',)",0.870848179,,0.240860105,,fc,3,0.216748834,0.010774568,0.911240491,9,12,29.0379467,forward,forward
426,20,Person 1,bye,"('fc',)",0.3759965,0.742811799,1.016468167,0.913960814,1.890772347,fc,Farewell,(),0.660792291,,0.694128156,,none,0,0.284795791,-0.322340011,0.792264652,1,1,39.80009842,forward,others
